<?xml version="1.0" encoding="UTF-8"?>

<xs:schema xmlns:xs="http://www.w3.org/2001/XMLSchema"
	 xmlns="http://langlv.homeproject.org/iso8583adapter/schemas"
	 targetNamespace="http://langlv.homeproject.org/iso8583adapter/schemas"
	 elementFormDefault="qualified"
	 attributeFormDefault="unqualified">
	<xs:import namespace="http://www.w3.org/XML/1998/namespace"/>
	<xs:element name="isomsg">
		<xs:complexType>
			<xs:sequence>
				<xs:element ref="field" maxOccurs="unbounded"/>
			</xs:sequence>
			<xs:attribute name="mti" type="xs:string"/>
			<xs:attribute name="pcode" type="xs:string"/>
		</xs:complexType>
	</xs:element>
	<xs:element name="field">
		<xs:complexType>
			<xs:simpleContent>
				<xs:extension base="xs:string">
					<xs:attribute name="id" type="xs:string"/>
					<xs:attribute name="value" type="xs:string"/>
				</xs:extension>
			</xs:simpleContent>
		</xs:complexType>
	</xs:element>
</xs:schema>